Text,is_toxic
วันๆ นี่คุยกะหมา แมว หมู ไก่ ม้า ควาย มากกว่าคุยกับคนไปละ,0
หล่อมากกก หล่อวัวตายควายล้มกันเลยทีเดียวววว,0
สิวเหี้ยไรขึ้นหลังหู เสียชาติเกิดมั้ย เกิดมามันต้องต้องโดดเด่นเด้งดึ๋งอย่าเช่นขึ้นที่หน้าไรงี้ อีควาย,0
อ่ะ ป่วยก็ป่วย งานจ้างก็ต้องทำ งานเรียนก็ต้องทำ วิชาดีไซน์ตัวร้ายกับควายอย่างกูเอง,0
นี่ก็เพิ่งรู้ว่า เกิดชาตินี้ชาติเดียว เป็นทั้ง เหี้ย เป็นทั้ง ควาย เลย คุ้มแท้ๆ,1
โว้ยอีควาย หนักกว่ากูก็มึงอะ,1
ขอโทษ นะครับ อยากได้ควายให้ไปคบกับคนอื่นนะ พอดีกูคนไม่ใช่ควาย,1
ปลั๊กไฟอยู่พื้น เลยลงมานอนบนพื้น อีควาย ไฟจะดูดกูมั้ย เสียบชาร์จไฟก็แลบออกมา อีเหี้ยยย,0
กูมันโง่เองที่ยังเชื่อคำสัญญาบ้าบอของคนคนนึงอยู่ กูนี้มันควายจริงๆ,0
ควายมันอยู่บนดินไง มันบินไม่ได้,0
เมื่อเช้าก็ควาย ตอนนี้ก็หมา ใครทำไรมึง,0
ความคิดต่ำๆอีควาย ไม่ให้เกียรติผู้หญิง สันดาน,1
ควายแดงเมิงด่ารัฐบาลจนรองนายกป่วย พวกมึงกำลังทำลายชาติรู้มั้ย มั้ย มั้ย มั้ยยยยยยยยย,1
เออ มันปากหมา กูรู้ แต่กูรักไง กูรักไปแล้วเว้ย ทำไงได้ว้ะ ไม่เป็นกูไม่รู้หรอก มุมดีๆมันก็เยอะจนกูลืมไม่ลงเหมือนกันแหละ แม่ง,0
เมือเราถูกเข้าใจผิดสิ่งที่ยากที่สุดคือพยายามปรับความเข้าใจกับควายด้วยภาษาคน,1
ปฏิวัติมาแทบตาย สุดท้ายได้ควายเป็นนายก,1
คนไทยจะโกรธมากถ้าพูดว่าสีซอให้ควายฟัง ทั้งๆที่ตัวเองไม่รับฟังความเห็นของผู้อื่น ยึดติดในความคิดของตัวเอง ชาติไม่เจริญไม่โทษใคร,1
บางทีก็สงสัยนะว่าตัวเองเลี้ยงหมาหรือหมูหรือหมีขาวล่าสุดเลี้ยงแกะอ้วน,0
รองเท้าใหม่ก็กัดจริงกัดจัง เป็นหมาหรอสาด,0
พวกมอเตอร์ไซค์ที่จอดติดไฟแดงไม่เป็น ต้องวิ่งฝ่าออกไป พวกนี้คุณภาพชีวิตต่ำกว่าหมาอีกนะ มันพร้อมตายได้ทุกเมื่อ ตายแล้วเสือกเดือดร้อนคนอื่นอีก,1
ก็แค่หมาที่คิดว่าตัวเองเป็นสิงห์,0
คนที่เกลียดหมาแมว ลองทำใจแค่วันเดียว หยิบยื่นให้เขาบ้าง,0
สงสัยปากหมาเกินเยียวยา,1
อหหมาหอน แล้วคนข้างบ้านตาย อหอย่ามาหลอกนะ กูแช่งจริงๆด้วย กูไม่ได้โกหก,0
เป็นหมาก็ดีนะไม่ต้องโดนดุโดนบ่นโดนว่า ก็ดีอ่ะ,0
เหมือนหมาตัวนึงที่รอเจ้าของมาเล่นด้วยเวลาที่เขาว่างอ่ะ,0
เลือกเพื่อนนี่ ต้องดูให้ดีแค่ไหนวะ คนไหนจริงใจคนไหนตอแหล,0
คือหนูจะเป็นคนตอแหลแบบนี้ไปตลอดชีวิตเลยเหรอ,1
เวลาพูดแล้วไม่มีความจริงในนั้นอ่ะรู้สึกอะไรบ้างปะวะ หรือเพราะเป็นตอแหลเลยไม่รู้สึกอะไรเลย,1
บางคนออร่าตอแหลแรงมาก มองจากดาวอังคารลงมายังรู้เลยว่าไม่จริิงใจ,1
ต้องทักทายด้วยสีหน้าตอแหลยิ้มแย้มแจ่มใส กับสิ่งที่มึงทำกับกูงี้หรอ,1
สนุกจังโว้ย  เวลาแช่งทีมอื่น,0
แอนตี้ดูมีความสุขกับการโดนด่า พอโดนด่าก็แถ พอโดนด่าว่าตอแหลก็รับไม่ได้ เอิ่มจ้าๆ,1
เก่งจริงก้มาต่อหน้า ไม่ต้องโพสต์ด่า ลูกหมาหน้าจอ,1
แช่งให้พ่อแม่คนอื่นตายถ้าตอแหล แต่ดันโครมเข้าบ้านมึง สงสัยน่าจะได้กระเช้าแบบพวงหรีดเร็วๆนี้,1
ก็อย่างว่าแหละ คนพวกเดียวกัน มันก็อยู่ด้วยกันได้ไง ตอแหล ไร้สาระเหมือนกันไง,0
พอเถอะ อย่ามาตอแหลกับกูอีกเลย ไม่ได้อยู่ในฐานะที่ต้องมานั่งโกหกกันแล้วอ่ะ,1
ชีวิตเหมือนเกิดมานอนโง่ๆแล้วตายจากไป,0
การเปิดใจกลับกลายเป็นความโง่,0
หลายคนวิเคราะห์มีหลักการมาก แต่เราก็ไม่เข้าใจอยู่ดีค่ะ เราโง่,0
ไม่อยากไปรรอ่ะ ปวดหัว ปวดตีนปวดตีนด้วยความโครตโง่,0
เหี้ยไม่พอ โง่ซ้ำซาก,1
เจ้าภาพมาเลเซียแม่งโง่วะ ยุคโซเชี่ยลแทนที่จะทำดีๆ คนจะได้กลับไปท่องเที่ยวอัก นี่เหี้ยทั้งโรงแรม ทั้งน้ำใจ,1
ยอมให้ ไม่ได้หมายความว่าโง่,0
อย่าไปโชว์ความโง่ของตัวเองให้คนอื่นดูเลย,0
แล้วอีกอย่างนะ เห็นคนนั้น คนนี้ทำอะไรแล้วได้เงิน พอทำเองบ้างเสือกเจ๊ง แล้วมาว่าคนไม่ดี โง่เองป่าววะ,0
มีเวลาก็หัดศึกษาเองบ้างสิคะ อิโง่ คนเค้ารู้เค้าถึงตอบ ไม่รุแล้วมาเหวี่ยงใช่เรื่องป่ะ ทุเรส ออกงานมีเวลาก็หัดดูเอง ไม่ใช่รอให้คนอื่นมาประเคน,1
ประชาชนเลว ประชาชนชอบใส่ร้าย ประชาชนโง่ ประชาชนถูกจ้างมา ทหารคนดีมากครับ,1
ทำไมมันชอบบ่นว่าตัวเองอ้วน ควรบ่นความตอแหลตัวเองมากกว่า,1
ใน ทวต นี่มันก็ฮาดีนะมันจะมีคนโง่ในโง่อีกที ที่คนฟอลเยอะๆและทำตัวเหมือนรู้ทุกสิ่งอะ แต่เสือกเป็นคนที่โง่มากๆในสายตาของคนที่รู้ความจริง,1
อวยพรไปงั้นอ่ะ ในใจกูแช่งให้พวกมึงไปกันไม่รอดอยู่ รู้ไว้ไอ่โง่,1
ไม่มีสัจจะในหมู่คนเลวนะอีหนู,0
ยามบ้านเมืองวิกฤติ ดี เลว ถูก ผิด มองไม่ชัด มีแต่ แข็ง อ่อน สูง ต่ำ รวย จน และผู้พิชิตคือวีรบุรุษ ผู้แพ้คือโจร โจโฉ,0
เห็นแฟนเปลี่ยนสีผม นี่เลยไปทำสีบ้าง สีพลาดไปรอบนึงต้องแก้ใหม่ สุดท้ายสีที่ได้ก็ไม่ได้เลวร้ายอะไรนะ แค่ไม่ใช่สีที่เลือกไว้ตอนแรกแค่นั้น,0
ความจริงแม่งก็เลวไม่ต่างกันมากหรอก,1
ยิ่งโตยิ่งเชื่อในประโยคที่ว่า โลกแม่งจะสอนให้เราเลวขึ้น,0
อย่างน้อยช่วงเวลาที่เลวร้ายที่สุดในชีวิต มันทำให้เราได้เรียนรู้ว่าทุกปัญหามีทางออกเสมอ ไม่ว่าปัญหานั้นจะเล็กหรือใหญ่เพียงใด,0
ไม่มีใครดีที่สุด ไม่มีใครเลวที่สุด ถ้ายังรู้จักกันไม่ถึงที่สุด,0
ทำดีมาทั้งชีวิต พลาดครั้งเดียวกลายเป็นเลวไม่มีชิ้นดี,0
คำพูดนี่มีพลังจริงๆคนที่พูดเอาดีเข้าตัวเอาชั่วให้คนอื่น ทั้งที่ฝ่ายดีก็ชั่วพอกัน แต่แค่ไม่มีคนเล่า คนก็มองว่าฝ่ายชั่วว่าเลวอยู่ฝ่ายเดียวละ,0
ผู้ชายคนนึงบนรถเมล์พูดว่าแฟนซื้อของให้บ่อยราคาแพงๆ ไม่ได้ดูน่าอิจฉานะ ดูเหี้ยอะ แมงดา,1
ถึงเป็นเหี้ยเป็นยักษ์ยังรักลูก มึงต้องถูกสาบแช่งแรงกว่าเหี้ย จิตใจเลวร้ายไม่ไหวจะเคลียร์ อิหัวใจต่ำเตี้ยกว่าโคลตม,1
อีสิวเลว เหมือนรู้เลยนะว่าจะเปิดเทอมแล้ว แย่งกันขึ้นเชียว ขอบคุณจ้ะ,0
ชอบแมงดาขนาดนี้ เป็นกะหรี่ป่ะจ๊ะ,1
สมเป็นหัวหน้าคนชั่ว,1
ใครที่ดูถูกว่ารับงาน ว่ากะหรี่ เชิญคุณดูถูกได้ตามสบายค่ะ คนเรามีโอกาสในชีวิตต่างกัน,0
งงตัวเองมากอ่ะ คือชอบคนเยอะมาก นี้กูเป็นกะหรี่ หรือยังไง  เด็กเกินจะเข้าใจความรักสิน่ะ,0
อยากกินปูผัดผงกะหรี่,0
กินแกงกะหรี่ เจอแกงเหลืองอ๋อย ติดหวาน ใส่มันฝรั่งและแครอท คำถามคือ นี่เป็นแกงสูตรประเทศอะไร,0
เข้าคณะวันนี้ทาปากสีชมพูด้วยคอนเซ็ปต์ถ่ายจากดาวอังคารต้องเห็นปากกูชัดคือโดนคนด่าว่าตอแหลเยอะมาก ดีใจมาก ยิ้มรับ ทาแล้วเลือดกะหรี่พุ่งพล่าน,0
อยู่ดีๆก็อยากกินข้าวแกงกะหรี่ทำเองไม่เป็น ไปซื้อแบบสำเร็จรูปมากินละกัน,0
อยากกะหรี่ให้มากกว่ารุ่นพี่ที่ทำงาน สุดท้ายกูเเพ้,1
ขนส่ง ยี่ห้อ กะหรี่ นี่ สู้ ไปรษณีย์ไทยไม่ได้เลยจริงๆ   โทรถามทาง มันทุกครั้งที่จะมาส่ง,1
ผู้ชายเกาะผู้หญิงกิน  แมงดา,0
คำพูดที่มันทำให้ดูเป็นคนทัศคติต่ำไปเลย สำหรับเรา คือคำว่าประเทศเฮงซวย ประเทศกะลาแลนด์ ประเทศไม่ผิดอะไร คนในประเทศต่างหากที่ทำเรื่องเฮงซวย,0
บางคนความคิดก็ต่ำยิ่งกว่าสัตว์เซลล์เดียวอีก,0
แบ่งแยกแล้วมึงสูงขึ้นเหรอ เปล่าค่ะใจมึงอ่ะต่ำมาก กศษไม่ช่วยห่าไร เลวด้วยตัวเองล้วนๆ,1
ทุเรียนคือความชั่วร้าย,0
ทำไมบางคนถึงสนุกกับการทำตัวหยาบคายหรือพ่นคำหยาบคายในพื้นที่ของคนอื่นอ่ะ รู้เปล่าว่าความถ่อยมันไม่ได้เท่เลย มันต่ำเว้ย,0
ดี ชั่ว อยู่ที่ ตัว ทำ สูง ต่ำ อยู่ ที่ ทำ ตัว  คน เรา ทำ อย่าง ไร ก็ ได้ อย่าง นั้น แหละ  ฝืน ธรรม ชาติ ไม่ ได้ หรอก,0
ไม่มีใครรับในมุมที่แย่ที่สุด จุดต่ำสุด หรือความเลวร้ายที่สุดได้ นอกจากเพื่อน,0
คนอื่นอ่านออกเสียงในใจกันมั้ย มีเสียงสูง ต่ำ แผ่ว เบา เวลาอ่านทวิตรึเปล่า,0
ต่ำ ต่ำมากๆต่ำสุดๆถูกเลี้ยงมาแบบ ไหนอ่ะต่ำตมดีจัง,1
อุบาดชาติชั่วที่สุดต่ำตม,1
แต่งตัวไม่วาบหวิวมันก็ลวนลามค่ะ ความคิดแม่งชั้นต่ำ,1
เครื่องสักการบูชาของคนชั่วร้ายเป็นสิ่งน่าเกลียดน่าชัง เมื่อเขานำมาด้วยความตั้งใจชั่วจะยิ่งกว่านั้นสักเท่าใด,0
ฉันเกิดมาเพื่อเป็นแมงดา,1
ถึงพลอจะชั่ว เป็นแมวขโมย เห็นแก่กิน ชอบด่าและกากมาก แต่ก็อบอุ่นที่สุดเลยนะ,0
มึงมันเรด ฮึ่ย ไม่รู้จะด่ายังไงแล้ว ไอ้สารชั่ว,1
พวกชั่ว กูกลัวผีอะไม่ใช่กูส่องกระจก,0
อย่าดูหมิ่นความชั่วว่าเล็กน้อย คงจักไม่มีผลมาถึงตัว,0
มึงไม่ควรขอบคุณกูนะ มึงควรขอโทษ ที่พากูไปหลงและส่งไม่ถึงที่ แถมไปไม่ทันนัด คนชั่ว,1
ก็ทำงานส่งไห้มึงเรียน มึงเสือกทำตัวเหี้ยๆ กูอยากตบมึงเด้ อีน้องชั่วอีใจบาป,1
กลิ่นแมงดาโคตรเฟคคคคค แงงงง ฉุนน,0
คราวนี้เอลไม่ทน เลยเดินตรงไปหาแม่งเลยแล้วถามว่านี่อะไร มึงหลอกเพื่อนกูหรอไอ้แมงดา  แบบโรงอาหารคนมันเยอะอยู่แล้ว พอเสียงดังก็หันมองกัน,1
อหเอ๊ย แมงดาด่าผู้ชายที่เกาะผู้หญิงแล้วผู้หญิงที่เกาะผู้ชายนี่เรียกว่าอะไร,1
วิธีดักแมงดาคือ ทำเป็นพูดว่าจนๆ แล้วเค๊าจะตีจากไปเอง,0
โอ๊ยย น่าสงสารมากอ่ะ ไม่ได้ชั่วโดยกำเนิด แต่ชั่วเพราะผู้เลี้ยงดู,0
ไม่ต่างจากปลิง แมงดา เห็บเลยจ่ะ เป็นผชด้วยมาเกาะใช้ชื่อลูกงี้,1
อยากดัดสันดานน้องโดยการไม่จ่ายค่าเน็ตบ้าน  อิดอก มึงมันแมงดา คอยแต่ผลาญเงินเคยช่วยอะไรบ้างมั้ย,1
มื้อประหยัด ข้าวไข่เจียวน้ำพริกแมงดา น้ำพริกเอามาจากบ้าน ฟรี,0
หนี้ส่วนไหนของแม่กูก็ไม่ใช่ เสือกมาเกาะแม่กูอีก ทำงานถึงแค่เที่ยงจะเอา งง ประสาท แมงดา,1
ถ้าไม่มีกลิ่นแมงดาเราก็โอเคนะ,0
กะว่าจะเป็นแมงดาไปตลอดชีวิตซะ,1
ขยะสามพันกว่าไฟล์อาศัยอยู่ในคอมฉัน,0
กล้าพูดได้เต็มปาก ทุกวันนี้อยู่ด้วยใจล้วนๆ เงินเดือนเท่าเห็บหมา ทำงานเท่าปลาวาฬ โดนเอาเปรียบเท่าแปซิฟิก ดีดี๊,0
สนุกไหมกับการเป็นเห็บหมาดูดเลือดเนื้อคนอื่น ทำนาบนหลังคนเห็นใจกันบ้าง,1
เอาจริงนะ เป็นคนไม่ชอบดึงเห็บ เลี้ยงหมาจะป้องกันตลอด หยอดยาตามกำหนด น่ากลัวๆ,0
หิวข้าว แต่ป้าหาเห็บหมาอยู่,0
เปนคนเกลียดเห็บและทาร์ซาน,0
สิวเม็ดเท่าเห็บหมา,0
แสดงให้เต็มที่ให้สมกับความดีเลิศของว่าที่เจ้าสาวนาย เราบอกตรงนี้เรากับนายไม่มีทางมาลงเอยกันได้แน่นอน เพราะเราเกลียดเห็บเหาที่เกาะอยู่ข้างนาย,1
กูบอกตัวเองไว้ว่าจารีบนอนคืนนี้ ห่าราก มีเรื่องเห็บหมามาอีกกก,0
ฟรีไซส์สมัยนี้ก็ตัวเท่าเห็บหมา อกแล้วบอกฟรีไซส์ แถวบ้านเรียกไซส์,0
เงินเดือนยังกะเห็บหมา ให้งานกูมายังกะโคลงช้าง,0
ผู้ชายเจ้าชู้ก็เหมือนกับเห็บหมานั้นแหละ,1
ยาหรือเห็บหมาอ่ะหมอ เม็ดจะใหญ่ไปไหนอ่ะ กลัวหนูไม่อิ่มหรอ,0
เห็บหมานี่แม่งหายตัวได้รึไงวะ โอ้ยย เลี้ยงกะไม่ได้เลี้ยงหมา อ๊ากกก แล้วต้องเดินส่องตามพื้นห้อง อิเหี้ยยยย,0
ไฟติด ปลวกไม่ขึ้น โอเคใช้งานได้,0
เข้าไอจีตัวเองก็มีแต่รูปของกิน ลงเองหิวเองอีปลวกกก,0
ซ่อนความหน้าปลวกภายใต้หน้ากาก,0
น้ำหยดลงหินทุกวันหินยังกร่อย ปลวกกัดไม้ทุกวันไม้ยังผุ,0
ถ้าจะว่าแบบนั้นก็แล้วแต่ คนของเราได้การยอมรับมากมาย แล้วฉันจะให้ค่ามดปลวกที่เก่งแต่หน้าคีย์บอร์ดทำไม,1
สูบบุหรี่บ้านมึง ลมพัดมาบ้านกู  โอเค บ้านกูฉีดปลวกไปทางบ้านมึง ที่ๆพวกมึงนั่งเลย  หายกัน,0
เกลียดมึงยิ่งกว่าไส้เดือนกิ้งกือด่ากูอีปลวกอีกสิ เอาสิ แก้แค้นที่กูด่ามึงกับเมียว่าตอแหลอะ จะโกรธกูทำไม ก็มึงสองคนตอแหลลงตับจริง ๆอิเหี้ย,1
วันนี้เลิกงานกลับบ้านเร็ว มีฉีดปลวก เราไม่ใช่ปลวก เราจึงต้องกลับบ้าน,0
เจอเม้นท์แย่ๆ จากปลวก หรือจากติ่งด้วยกันเองใน  แนะนำให้บล๊อคแล้วลบทิ้ง เพราะมันมีนักข่าวชุ่ยๆนั่งส่องแท็กแล้วแคพไปเขียนข่าวด่าทั้งด้อม,1
งานเมื่อวานทำไม่ได้ วันนี้ทำได้ชิวๆ คำคม งานเร็วแต่ปลวก หรือจะสู้งานช้าแต่เป๊ะ,0
ฉีดปลวกอะไรกันแต่เช้าวะเนี่ย,0
