Text,is_toxic
ไม่เคยขับรถเส้นไหนแล้วคิดว่าจัญไรเท่าเส้นคลอง  อะ ขับ  แช่ขวาเกือบทุกคัน กลับรถตรงไหนก็กลับ กูขับมาตัดหน้ากูกลับรถเฉย,0
สื่อไทยมาแล้วโว้ย มาพร้อมจัญไรบรรณที่มี,1
บอกว่ากูดีเกินไป โถววว ความเหี้ยกูอะระดับสิบ ยังไม่รวมจัญไร ปากหมา กวนตีน,0
ไหนใครว่ากูไม่ซิง เดะวิ่งไปถีบปาก เห็นกูจัญไรหน่อย แหม๋เอาใหญ่,1
ศิษย์วัดธรรมกายคลั่งศาสนาฉิบหาย ชอบด่าคนอิสลาม ตรรกะควายๆ นี่ใกล้จะตายแล้วยังไม่มีความคิดอีกหรอคะ,1
ขอหนีไปปฏิบัติธรรมที่วัดธรรมกายได้ไหมเนี่ย เผื่อจิดใจจะสงบขึ้นและลบความบัดซบกับความฉิบหายออกจากชีวิตชั้น,0
คนจัญไรคงเยอะเนอะฝนเลยตกหนักและน้ำท่วมกรุงเทพ ทางต่างระดับยมราช  เลียนแบบประยุทธ์มา,1
จรรยาบรรณไม่มี มีแต่ความจัญไร สำนักข่าวแบบนี้,1
ตัดได้จัญไรมาก ไอ้เหี้ยจวพ มึง สั้นกว่าเอ็มวีเวอร์ชั่นสั้นของศิลปินญี่ปุ่นอีก มีความตีแสกหน้า อยากดูเหรอ ซื้อซิจ๊ะ ไอ้สัสสส,1
จริงๆก็ไม่ได้ชอบรัฐบาลทหารหรอกนะ   แต่จากทางเลือกที่มีอยู่ แม่งโคตรจัญไร,1
เป็นเยาวชนก็จริงแต่จัญไรกว่าผู้บรรลุนิติภาวะอีกนะฟฟฟฟฟฟ,1
แล้วเด็กมันจะโตมามีชีวิตแบบไหนวะ จัญไรจริงๆ คนเรา พวกมึงนี่ไม่ควรมีชีวิตอยู่บนโลกอะ ไปตายเถอะ ถ้าจะมีชีวิตอยู่เพื่อทำลายชีวิตคนอื่นแบบนี้,1
มีความสุขบนความเป็นความตายคนอื่นไม่จัญไรทำไม่ได้นะเฟย,1
รัฐบาล ชอบลับๆล่อๆ แอบทำ แอบกำหนด พูดไม่หมด มีเลศนัย ไม่แถลงให้ประชาชนได้เข้าใจ จัญไร ที่ซู๊ดดดดด ฆรวย  อุ้ยยย  ตกใจ,1
คนดีชอบแก้ไข คนจัญไรชอบแก้ตัว คนชั่วชอบทำลาย คนมักง่ายชอบทิ้ง คนจริงชอบทำ คนระยำชอบติ,0
ถ้าเป็นพระยังอัปรีย์จัญไรขนาดนี้กูว่านิมนต์มึงสึกไปซะดีกว่ามั้ง,1
จะไม่มีอะไรเหมือนเดิมเหมือนที่เคยในวันวานอีกแล้ว ความสุขุมนุ่มลึกจะกลับมา ความจัญไรจะคงอยู่แต่คงไม่ได้มาก,0
ขอให้ความรักมีแต่ความจัญไร ข้าวของชิบหายให้บัลลัยทุกอย่าง คาดหวังสิ่งไหน ขอให้มีแต่คนขัดขวางไอ่ชั่วไอ่เลวไอ่ควายก็ขอใฟ้มึงต้องตายอย่างหมาเลย,1
โชคชะตาหัวควยมึงมันตัวสร้างความชิบหายสร้างแต่ความจัญไรให้กู มึงจะทำยังงี้กับกูไม่ได้ มึงมันโซอีเลว กูขอแช่งมึงให้มึงไม่มีความสุข,1
มึงชวนเพื่อนจัญไรเวลานี้หรอแจน ควรนอนม้ะงานเช้าแต่งเต็มนะพรุ่งนี้เนี่ย,0
เดี๋ยวไอ้เหี้ยเมือก แม่งก็บอกยังล้างระบอบทักษิณไม่หมด ต้องตั้งพรรคจัญไรไว้คอยบริการทหาร,1
คุกไทยยามนี้คงไม่ต่างจากนรกเท่าไหร่ เพราะพวกจัญไรลงไปชดใช้กรรมกันเยอะเชียว,1
สวีดัส สวัสดี วันพุธ ศาสนาพุทธ ไม่ช่วยให้ ชาวพุทธแต่ปาก หยุดจัญไรได้,1
รักกันนานๆ เลิกกันไวๆ ชิบหายจัญไร ตายไว โชคดี เย้,1
หมอร้อนเงินขนาดนั้นเลยหรอ ถึงต้องฆ่าหมาเพื่อเอาเงินประกัน เหี้ยจริงจัญไรจริง,1
ยุคคนจัญไรที่อยากป้ายสีใครออกสื่อก็ทำกันช่างง่ายดาย,1
วันนี้เจอคนจัญไรในมอด้วยอ่ะ คือเป็นปัญญาชนอยู่ในชุดนิสิตอ่ะ ทำไมถึงได้ใช้ส้นตีนคิดทำอะไรแบบนี้ออกมา,1
ยุคนี้คนอัปปรีย์เป็นใหญ่ คนจัญไรมีอำนาจ คนอุบาทได้เห่าหอน ฆาตรกรได้เป็นฮีโร่ คนโง่คอยชื่นชม,1
จรรยาบรรณ หรือจัญไร สื่อไทยแข่งเหี้ กับตำรวจหรอ,1
เปรี้ยวหั่นศพดังท่วมสื่อ   หั่นศพเงียบฉี่  สื่อไทย จัญไร ยังเบาไป,1
สื่อที่ลงแต่ข่าวเสี้ยมและแซะ สะกดคำว่าจรรยาบรรณเป็น แต่ไม่ยอมเข้าใจความหมายสินะ จรรยาบรรณไม่รู้จัก รู้จักแต่จัญไร,1
เอาไปเหอะเหรียญ เอาความจัญไรความอัปปรีดอกทองไปด้วย จะโกงก็โกงเนียนๆสิวะ มึงเล่นเอาให้เค้ารู้กันทุกชาติเลย ชาติหมาแน่มึง,1
บอลไทยแม่งจัญไร กวย เล่นเหี้ยๆ มาเลย์มันสู้ไม่ได้แล้วสัส มิติทำเกมไม่มีเลยเหี้ย,1
มาเลย์เล่นจัญไรมากกก อิเหี้ยยยย หัวร้อนน,1
ด่าว่าจัญไรยังรู้สึกดีกว่าคนอย่างมึงอ่ะนะฟาง คนออฟฟิสนี้มันร้ายนะคะหัวหน้า หัวหน้ากูนี่แหละแกนนำ ฮือออ,1
หอยที่มันอยู่ที่ตาตุ่มอย่างมัน ถุย ทำตัวเป็นนางพญา เมียน้อยที่เขาไม่ซื้ออะไรให้เลย,1
ทำไมให้เข้าช่องเดียว แล้วมันจะทันหรอ หอยหลอดดดดด,0
เอาจริงๆคือประเทศเราได้เหรียญเยอะกว่านี้ อาจนำเวียดด้วยซ้ำ แต่เพราะอีเจ้าภาพแม่งโกงแบบหน้าด้านๆไง ไทยถึงได้ที่ อีหอย,1
รัฐบาลยังถังแตกนับประสาไรกับประชาชนอีหอย,1
ไม่เคยเอาเสียงประชาชนไปปรับ อยากทำไรก็ทำ ละก็มาอ้างว่าเข้าใจรัฐบาลหน่อย เข้าใจกับหอยไรล่ะ,1
รัฐบาลมองการไกลชิหอยซื้อเรือดำน้ำมาเตรียมใช้ในกทมนี่เอง,1
ขอเวลาให้กูได้พักผ่อนและนอนได้มั้ย ไม่เอาการบ้านแล้วได้มั้ย แผนบลาๆๆหอยหลอดนี่ก็เยอะไป ดีนะที่งานวิจัยมันถูกซัพพอร์ตไปเยอะแล้ว ไม่งั้นกูตาย,0
นักร้องดังไม่ดังไม่ได้อยู่ที่มึงคนเดียวแมะ บางทีเค้าดังแต่มึงไม่ออกจากกะลามาดู มึงก็ไม่รู้จักเค้าหรอก อีหอยขม,1
อีกหนึ่งความฉห บนท้องถนนคือ ตำรวจตั้งด่าน แล้วรอเขียนใบสั่ง อีหอย สร้างความรำคาญ รถติดเพิ่มเติม,1
ถึง อีหอย ถ้าเห็นทวิตกูขอให้กรรมตามทันมึง อีเลว กูจะรอวันนั้น,1
ถ้ารถตู้ยังไม่ออกตอนนี้กูจะกลานเป็นต้นแคกตัสแล้วค่ะ หอย,0
พี่รหัสแม่งกวนตีนชิบหาย หอยหลอด,0
อีดอก ร้านบางร้านขายของมึงไม่ขอบคุณลูกค้าเลยหรือไง กุซื้อของมึงกุยังขอบคุณมึงอ่ะ  หอยหลอด,1
มีสิทธิอะไรมาบอกว่าฉันจะไม่จบ แช่งตั้งแต่วันแรกเลยนะมึง ว้อย คิดแล้วก็ขำ หอยหลอด คำพูดดี ๆมีตั้งเยอะทำไมไม่พูด หุนหวย,0
กูไม่ชอบคนพูดจาแบบนี้เลยอีห่า,1
ไม่อยากจะพูดถึงซีเกมส์ครับ เจ้าภาพกวนส้นตีนขนาดนี้ มึงไม่แข่งกันเองให้เหรียญกันเองเลยล่ะ หอยหลอด,1
รู้มาตลอดว่ากดดันในการเปลี่ยนแนวเพลงแล้วฟคไม่โอเค แต่ไม่คิดว่าจะใช้วิธีนี้ ใจร้ายชิบหายอิดวกฟคหน้าหอย สาปแช่งมันนน,1
แถวบ้านมีงานศาลเจ้าแม่ซัมติง เปิดเพลงสนั่นหวั่นไหวมาก ถ้ากูเป็นเจ้าแม่คงสาปแช่งอีพวกนี้ไปนานละ หอยหลอด คนจะหลับจะนอน,1
เป็นประเทศที่ปชชด่ายังไงก็ไม่ละอายใจ หน้าด้านขั้นสุด แล้วยังอยากให้เยาวชนเติบโตเป็นคนดี หอย,1
สัส โทรหาศูนย์ก็ไม่รับ ดอกหอย,1
กับหอยมันบริการโคตรเร็ว พอกับหำทำไมมันไม่สนใจตูเลย,1
อีหอยหลอดนี้ยังไม่ตายหรอคะ,1
ไม่ชอบเวลาตัวเองซื้อคอนแทคมาละคิดว่าใส่แล้วสวยแน่ๆ พอใส่จริงๆเหมือนผีเลยอีหอย,0
รำคาญ อีหอย มีเงินกูตามไม่ให้ผลุดไม่ให้เกิดเลย,1
ปากบอกว่ายุ่ง แต่เสือกถ่ายรูปเล่นกัน โว๊ะ แล้วก็โยนงานร้อนมาให้กุ อีห่า,1
เดี๋ยวนี้คนเขียนสันดานเป็นสันดาร ทูนหัวเป็นทูลหัว สถุนเป็นสถุล กลอกตาเป็นกรอกตาหมดแล้วอะ เฮ้อ,0
ภารกิจวันนี้ คือการซื้อผ้าเย็บปลอกหมอนให้คุณใบโต เสร็จร้อยเรียบ แต่ฝีเย็บนี่เลวมากอะ สมกับเป็นสถุลสตรีจิงๆ,0
หงิดระดับที่ไมีจำเป็นต้องรักษาความเป็นญ พร้อมด่าเป็นภาษาพ่อขุนยันความสถุลในตัว,0
ประกาศตัวว่าเป็นแฟนคลับเขา ไม่อยากให้ใครด่า แต่ตัวเองก็ไปด่าไอดอลคนอื่น อะไรว๊าาาา ตัวเองด่าได้สถุลได้ แต่คนอื่นห้ามมาร้ายใส่งี้หรอ,1
เสียชาติเกิดจังค่ะ ตํ่า สถุล คำพูดแบบนี้เก็บไว้พูดขอชีวิตตอนตายนะค่ะ,1
คนประเภทที่ชอบอะไรสถุลๆ ถ่อยๆแล้วคิดว่าเท่เนี่ย น่ากลัวชิบหาย  เคยเผลอไปอยู่ใกล้แล้วรับไม่ได้จริงๆ,1
ไม่ใช่เรื่องที่มึงจะมาด่ากู เพราะถ้ามึงด่ากูมึงล้ำเส้นแล้วล่ะ อีดอก อีสถุล,1
ที่ดูดีมีวิวัฒนาการขึ้นมาหน่อยนึง ก็จะบอกว่า มีไว้ทำให้ตัวเลขดูดีมีสกุล  แต่ถ้าทำมั่ว แก้คำว่า สกุล เป็น สถุล น่าจะใกล้เคียง,0
สถุลสัตว์ๆ นี่มันนายกหรืออันธพาลกันแน่บอกที,1
คนแรงๆนี่ถ้าเราสนิท เราจะบอกว่าเป็นคนตรงๆ  แต่ถ้าไม่สนิทหรืออยู่ฝ่ายตรงข้ามจะเรียกสถุล,0
พวกที่ชอบพูดจาต่ำๆหยาบคายกับทุกคนแล้วบอกว่าเป็นสไตล์ เอิ่มมม สไตล์หรือสถุลค่ะ,1
หลายครั้งแล้วนะ อีนี่ เป็นติ่งโดที่ถ่อยสถุลมาก ที่บ้านมึงเลี้ยงมายังไง คลุกข้าวให้กินพร้อมหมาแถวบ้านใช่มะ ปากถึงเหี้ยแบบนี้,1
คนเราก็แปลกดีนะ นิยมชมชอบพวกที่ทำตัวสถุล กักฬะ ยกยอปอปั้นกันเข้าไป มันไม่ใช่แนวเราอะ สถุลก็คือสกุล ไม่มีคำชมอะไรใดๆจะมอบให้ทั้งนั้น,1
ไอ้เหี้ยแล้วเมื่อกี้ลุงแก่ๆจะขึ้นรถ แม่งพอรู้ว่าจะไปใกล้ๆก็ไม่รับ สถุลที่ประเทศนี้หรือที่คน,1
โชคดีมากที่กูเรียนมา การรับน้องนี่ไม่มีอะไรสถุลแบบที่ทุกวันนี้เห็นในข่าว คนรับน้องกูลูกคุณหนู คนจัดก็ลูกคุณหนู สบายเลย,0
ฝรั่งที่มาเที่ยวเมืองไทย พยายามแต่งตัวให้เข้ากับอากาศมาก เสื้อกางเกงโปร่งดูสถุลย์ๆ แล้วดูคนไทย ใส่ยาวหนาอย่างกะอากาศติดลบ  องศา,1
ถ่อยสถุลวันๆเอาแต่ดูถูกประเทศตัวเอง แต่ไม่ไสหัวไปไหนสักที่ ตลกว่ะ ไอ้ ป,1
ลุงนี้เลวต่ำทรามยิ่งกว่าสัตว์นรก ด่าเหี้ยยังสงสารเหี้ยเลยสถุลมากขอให้ตายทรมานยิ่งกว่าหมาที่มันทับ,1
บางทีก็สงสารตัวเอง ที่สมองมันสั่งให้มีมารยาทกับอิพวกสถุลหยาบคาย คือไม่เข้าใจตัวเองว่าโดนมันหยาบคายใส่จะนิ่งทำไม ด่ามันกลับซิอิควัย,1
ที่ทำแต่ละเรื่อง สถุลๆเหล่านั้นก็ไม่ใช่วัฒนธรรมของประเทศไหนเหมือนกันนะ,1
วัดธรรมกายบริจาคถุง  ช่วยป้องกันชาวกรุงเทพจากน้ำบ่าปี  แต่พวกมันบางตัวกลับเนรคุณสถุลสัตว์,1
เจอแบบนี้ทีไร ผมต้องแช่งให้บ้านไฟไหม้ มีอันเป็นไปตายห่าตายโหงทุกรายอะ,1
ประเทศห่านี่หน้าด้านลืม,1
รู้สึกว่าตัวเองตอนนี้แม่งโคตรงอแงอ่ะ เหี้ยไรก็ไม่เอา เหี้ยไรก็ไม่ถูกใจสักอย่าง โคตรน่ารำคาญตัวเองตอนเป็นแบบนี้อ่ะ อยากเอาตัวเองไปทิ้ง อีห่า,1
ไลน์แม่งเป็นห่าอะไร ไม่ได้ปิดเสียงแจ้งเตือนก็ไม่เด้งแจ้งเตือน ทั้งๆที่เพื่อนตอบนานละ แต่พอเข้าแอปไปเสือกสั่น แล้วกูจะตั้งแจ้งเตือนเพื่อ สัส,0
เกลียดการทำงานไม่เป็นระบบ งานเร่ง งานห่าได้ๆก็แล้วแต่ที่ไม่รอบคอบ ไม่ละเอียด เหนื่อยตอนแรกดีกว่ามาเหนื่อยแก้เรื่อยๆป่ะ,0
ไอ้พวกที่บอกว่าภาษาจีนง่ายแค่นี้เอง อีห่าหอย มึงมาสอบเขียนตัวจีนแทนกูมั๊ยสัส,1
ไอสัสหัวเสียแต่ต้นเกม แม่งบอกบัตฝั่งนู่นแม่งเก่ง ดูบัตฝั่งเรากระจู๋หมา ห่าไร สัส เปนไงหล่ะตอนหลังกุคิลได้ มากกว่าพวกมึงตั้งเยอะ ควยย,1
เล่นอย่างนี้ลิ้วไม่ต้องมีผู้รักษาประตูหรอก ไงลูกก็ไปไม่ถึง อีห่า,1
แล้วเป็นห่าไรเอาหนังสือเรียนกุไปยัดข้างเตียงเนี่ยสัสส กุก็หาเข้าไปสิ จะไปเรียนสายละ รำคาญ,1
ยอมรับว่าเป็นคนใจร้าย แต่เวลาเจอพวกแบบ เดินมาขอค่ารถ ค่านมลูก ค่าข้าว นี่อยากเรียกตำรวจจับ อีห่า อ่อนแอก็ตายไป ตายห่าไปให้หมด,1
เจ็บใจฟุตบอลหญิง ถ้าเราได้คือแบบช่างแม่งเหอะเจ้าเหรียญห่าเหวไรที่โกงๆเนี๊ย แต่แม่งโกงบอลหญิงเราไป บอลชายล้างแค้นให้เด้อ,1
เน็ตหรือเน็ตอบตอีห่ากากชิบหาย,1
เกลียดตัวเองที่พูดภาษามาเลได้ ห่ารากก เสียเวลาร่ำเรียนมาแต่เด็ก ถุยยยย อีขี้โกง จะไม่พูดมาเลอีกต่อไป เหี้ยมาก หัวร้อนน โอ๊ยย เกลียดดดดดดดด,1
นี่ก็ไม่เข้าใจคนไทยที่พยายามจับผิดอ่ะ แบบตอนไทยเป็นเจ้าภาพก็ได้เหรียญเยอะ พอคนโวยเรื่องโกงเยอะๆก็หาว่าคิดไปเอง อีห่า,0
ติดตามเรื่องหมอฆ่าจงใจฆ่าหมาอยู่ อยากรู้ว่าจะโดนไล่ออกมั้ย จิงๆก็ควรไล่ออกนะ อีห่า ผีบ้ามาก ซื้อหมามาฆ่าเอาเงินประกันเนี่ยนะ,1
อีห่าคนเลวบนโลกนี้ก็เยอะจัง มันทำให้อดเป็นห่วงตัวเองและคนใกล้ชิดไม่ได้เลย,1
รถเมล์มึงไม่ต้องพัฒนาเหี้ยไรเยอะแยะหรอก มึงจอดให้ตรงป้ายก่อน สัด,1
แทนทีจะบริหารงานลดภาระให้ประชาชนแต่กลับเพิ่มภาระให้ประชาชนแทบทุกด้าน รัฐบาลเหี้ยๆเอาใจแต่นายทุน,1
เจอข่าวรัฐบาลสั่งลดประชากรสุนัขจรจัด ด้วยการวางยาเบื่อโคตรในโคตรเหี้ย,1
ไอจีโคตรเน่า กากด๋อย เข้าแล้วเด้ง,0
