Text,is_toxic
คิดถึงชุมชนจังเลยนะคะ ชีวิตบันเทิงเหี้ยๆ คนไข้ก็ต้องตรวจ แถมเจอเพื่อนประสาทแดกอีกเวน,1
อิผู้จัดควายยยยยยย อิโง่ แม่งเอ้ยยยยยยยยยยยยยย มึงเป็นประสาทหรอออออ กูบอกมึงแล้วว่าเดี๋ยวมึงจะต้องเอามาลด สัส,1
อย่ากวนตีน กวนประสาทไม่ชอบ น่ารำคาญ,1
สัส มึงหย่อนถุงอะไรรรรรรร๊ โอ้ย ประสาทแดกกับติ่งประเทศนี้โคตร,1
แฟนคลับบางกลุ่มแบบประสาทอะชอบหาเรื่องหัวร้อน ว่างๆค้นชื่อเมนตัวเองหาดูว่าใครพูดถึงว่ายังไงบัาง เป็นบ้าหรอ,1
กูต้องมานั่งอธิบาย ควยไรกับคำดูหมิ่น แหล่ะ หัวควยกระดอรีบ อะไรแบบนี้ มึงประสาทหรือเปล่า,1
ผ่านไปเดือนนึงมึงจะบอกว่าโหลดไม่ได้เลยหรอ ประสาทสัส แม่งเง้ย ขอให้เน็ตมึงล่ม แคสเกมส์ไม่ได้ เล่นเกมส์อยู่ดีๆแล้วคอมดับ เน็ตไม่ติด เกลียด,1
ไอ้เวร สอบซ่อมยังไม่ได้ทำ,0
รุมเร้าไปหมดเลยอีเหี้ย รู้เลยว่าปัญหาแรกมาจากการพักผ่อน เวรจริงๆ ลามปาม,0
ใช้เวรใช้กรรมหมดยัง,0
ดูทรงละยันเช้า แล้วคืนนี้ไม่ได้นอน กูควรแต่งหน้ายังไง อีเวร,0
ที่นอนดึก เพราะกูท้องเสียไอ้สัส แตงโมปั่น โคตรเวรเลยยยย,0
เวรกรรมอะไรทำไมต้องมาจำโครงสร้างแบบนี้ ทฤษฎีก้ไม่ได้ โครงสร้างอย่าหวังเลยเพ่,0
ตื่นเพราะปวดท้อง อะไรเนี่ย เวรกรรมอะไรคะ,0
ไม่ว่าจะคุยกับใครหรือคบกับใคร รู้สึกเหมือนเป็นฝ่ายรอตลอด ทำไมอะ ใจคอจะให้รอทุกคนที่ผ่านเข้ามาเลยหรอ ไม่ให้เค้ารอเราบ้างหรอ เวร,0
เหี้ยไรกะกูนักหนาอ่ะ สัส ทุกอย่างดีหมดยกเว้นครูเวรนี้อ่ะ อะไรวะพูดเหมือนพูดกับเด็กเล่นขี้ตัวเองไม่มีความใส่ใจห้าไรเลยอ่ะ,1
ละอีโรงแรมเวรนี่ก็ไม่มีรถเข็นให้อีก มึงจะต้องโบ้ยกันไปกันมา สัส หงุดหงิด,1
ไอ้หมาเวรข้างบ้านก็เห่าทุกคืน นี่เห่าตั้งแต่สองทุ่ม นอนไม่ได้ไง ยิ่งนอนไม่หลับ ไม่ได้นอน ปวดหัว ปวดหลัง ถ้ามีปืนตอนนี้แม่จะยิงทิ้งให้หมด สัส,1
เค้าคงอยากให้น้องได้ซีนแหละ แต่อีเดกเวร เดะกุแช่งให้พ่อมึงตายจริงๆเดะเถอะ เล่นอะไรไม่เข้าเรื่อง พ่อมึงไม่ด่าหรอ,1
เจอแต่ทีมส้นตีนไรไม่รู้ จะไปตามไล่คิลทำไมไม่รู้ แม่ง ละกูวิ่งกันป้อมสามเลนอยู่คนเดียวอีเวร ปัญญาอ่อน,1
เกลียดคำว่า มึงไปกูไป มึงทำกูทำ สัส ไม่มีหัวคิดเองหรอต้องเอาตามเพื่อนตลอด เวร,1
สลบตั้งแต่กลับบ้านและเพิ่งตื่น ดอกทอง,0
ใช้เงินเก่งอีดอกกก กลัวตัวเองแบ้ววว,0
การจราจรในกรุงเทพเป็นเหี้ยไรที่หัวร้อนสุดละ สุขภาพจิตเสียทุกวันเอดอก,0
เจ้าดอกไม้ตอนนี้เทอไปอยู่ไหนน อยากเป็นดอกไม้ดอกนั้นจังค่ะ ดอกที่ปู่จั๊บนั่นหน่ะค่ะ เขิลลเลยย,0
มันฟินแต่ฟินไม่สุด อีดอก,0
อีดอกกกกกก ลุกไปเรียนได้แล้วค่าาาาาา,0
กูหารากผักชีไม่เจอจริงๆค่ะอีดอกกกก,0
ทำไมจะปิดเทอมแล้วงานเยอะขนาดนี้ อีดอก,0
กูเกลียดมึงอีดอก สัสเหี้ย,1
การจราจรประเทศเหี้ยนี่กำลังทำให้กูบ้า ดอก,1
คนปากจัด อย่างกุ เรื่องด่า เป็นเรื่องปกติ แต่วันไหน ถ้า มันมากกว่า นี้ มุงโดนแน่ อีดอก หงุดหงิด เหี้ย,1
ความเชื่อใจอ่ะ มันไม่มีเลยหรอวะ เหี้ยมากอ่ะ กูเหี้ยมากอ่ะ อะไรคือ ดอกทอง ตอแหลหรอ เลวขนาดนั้นเลยหรอ ไม่อยากอยู่ละอ่ะ ความเชื่อใจยังไม่มีให้,1
เธอเป็นคนดีนะ คนดีที่ดอกทอง,1
อีโอเหี้ยไรนี่กูยอมใจจริงๆว่ะ หลายต่อหลายครั้งที่มีคนโควตทวิตมันแบ้วพอกูกดเข้าไป ปี๊บ คุณถูกบล็อก อีหน้าดอกสัส ต้องเอาอีคแอคเข้าตลอด,1
ในสันดาน เป็นคน ชอบเซลฟี่ กล้องไม่มี ที่หน้าเครื่อง เรื่องเศร้าหมอง พอได้เจอ กระจก,0
แล้วก็เพิ่งค้นพบสันดานตัวเองด้วยว่าที่ผ่านมา ฉันไม่ได้รักใครเลย นอกจากตัวเอง,0
สันดานไม่ได้มาตามสายเลือด เชื่อกู,0
ละพอสันดานเปิดเผยเป็นไง หยุดทุกอย่าง ไม่ได้พาไปไหน ของไรก็ไม่ได้ซื้อมาให้แดก มันทำเหมือนบ้านนี่เป็นอากาศธาตุ นี่ก็ทำเหมือนมันเป็นอากาศธาตุ,0
พวกไพร่ที่แท้ แดกกาแฟดำออฟฟิศฟรี เป็นที่ยอมรับ,1
น่าจะรู้ตัวได้แล้วม้างงงง คนเขาเกียจทั้งมขนาดนี้ จะตอแหลก็เอาให้สุดสิ หรือสันดานจริงๆมึงเริ่มออกมาแล้วล่ะ,1
มันคือเรื่องของมารยาทและการให้เกียรติอะถูกปะ ใช้ชื่อวงโปรโมท เชิญไป อัดล่วงหน้า พอมาถึงวันนี้คุณตัดวงเราออก ต้องสันดานขนาดไหน,1
พูดอะไรนึกถึงคนฟังบ้างอีเหี้ยโมโหละมาตะคอกกูจะไปรู้กับมึงปะสันดาน,1
ถึงหน้าดีสันดานหีก็ไร้ค่า ไร้ราคาไร้สเน่ห์หาผิดใจหมาย ไหนเงินทองเลี้ยงพ่อแม่อีเด็กควาย,1
หลอกกุเปลี่ยนดิสอยู่คนเด่ว สันดานหมา พวกคนเห้รย,1
นี่ไม่เคยโกรธใครขนาดนี้อะ ไม่มีมารยาท สันดานเสีย ทำตัวแบบหมดคำจะพูดอะ เห็นแก่ตัวแล้วยังเรื่องมาก อีเวน,1
ไม่อยากมีเพื่อนน้ำหน้าแบบมึงเลยควย พวกไม่มีปยก็ไม่เห็นค่าสันดาน,1
สันดานเหี้ยแล้วยังมารยาททรามอีก เหม็นกลิ่นคนประเภทนี้มากๆ,1
ก่อนจะบอกให้คนอื่นทำนิสัยดีๆ ไปปรับสันดานตัวเองให้ดีก่อนค่ะ อีเหี้ย,1
หน้าหยั่งกะส้นตีนสันดานยังเสือกเหี้ยอีก,1
ด่าลูกกูเหี้ย ตัวมึงเองก็เหี้ยไม่ต่างกันเลยเถอะทำมาเป็นดูดดี อีผี สันดานคน พิมพ์มาสวยให้ตายแต่จิตใจต่ำมึงก็ต่ำอยู่ดี,1
มึงกับกลุ่มมึงก็เหี้ยเหมือนกันหมดอ่ะ เหมาะสมกันดี ชอบแบบไหนก็เป็นแบบนั้นจริงๆด้วยสินะ สันดานเข้ากันดี   หืม,1
เปิดเพลงหาพ่อองมึงตอนนี้หรอไอสัส คนเค้าจะนอนพักผ่อนกันไอสันดาน,1
โชคดีแค่ไหนแล้วที่เขาอุส่ามาประจำชั้นสุดท้ายต้องมาออกเพราะสันดาน บางคน,1
แล้วท่านจะพบกันความกากของสกิลวาดรูปเราค่ะ อวดไว้ก่อน,0
ทำงงทำงาน สแกนนิ้วได้แล้วอีพวกไพร่,1
บางทีเกมก็เซ็นเซอร์คำหยาบแบบมากไป เช่น กาก หิว คืออหิวไม่ได้หยาบ  เวลาพิมพ์หิวต้องบอก หออิวอ ตลกไปแมะ,0
นี่แกะรูปพี่ยงมาจากคลิปกากๆเลยนะ,0
สิ่งที่ไม่มีวันเปลี่ยนคือความกากของรัฐบาล พวกพี่ไม่เคยทำอะไรสำเร็จเลย นอกจากทำตัวเบ่งใส่กับทำให้เรื่องชิบหายยิ่งขึ้น,1
ไอ้รัฐบาลกาก แกจะมาแตะบัญชีคนทำมาหากินที่ต้องเสียภาษีไปให้แกเอาไปผลาญโดยไม่ได้กลับมา โดยไม่โดนคนด่ายับมิได้,1
โหเล่นกากเองแล้วบอกกูโปร โปรพ่อง พูดไรให้เกียรติโน๊ตบุ๊กกูที่แบกรับไฟล์หนักขนาดนี้ไว้ด้วยครับ,1
นี่คือเกลียดจอฟไม่คิดตังค์มาก รำโว้ยยยยย กากแล้วยัง สมละะะะ,1
แค่นี้ยังทำไม่ได้เลย กาก,1
บางทีก็รู้สึกว่า เรามีรัฐบาลนี้ที่เฮงซวยพอๆกับรัฐบาลที่ได้รับเลือกตั้งมาเลย โคตรกาก,1
เริ่มไม่อยากได้รางวัลละ แมร่งดูกากๆ เน่าๆชอบกล คล้ายการซื้อวุฒิการศึกษาแถวบ้านกูเลย  ห่าน,1
อีพวกไพร่เงินเดือนยังไม่ออกสินะ,1
พูดไปสองไพร่เบี้ยนิ่งเสียตำลึงทอง,0
งานหลวง งานราช งานไพร่ งานเจ้า งานทุกอย่างแม่งสุมอยู่ในอาทิตย์นี้หมดเลย กูขอกาปฏิทินว่าเป็น สำหรับกูละกันนะคะ,0
กินคาวไม่กินหวานสันดานไพร่,0
เกิดเป็นไพร่ก็ต้องทำหน้าที่ไพร่   กางเล็บนวดๆ   เจ็บ โว้ยคนจะตากผ้าวอแวจังฟะอีแมวนี่นิ,0
นอนได้แล้วพรุ่งนี้ต้องไปใช้ชีวิตไพร่ๆ,0
ว่าแล้วไงงงง จะทวิตหลายทีละ นี่นั่งดูหลายรอบหลายมุมมาก ยังไงก็น่าจะไพร่หลังตัวเอง แต่ตัดใจไม่ทวิตทุกครั้งเลยเกลียดความหน้าบานของตัวเอง,0
นิสัยเสีย สันดานไพร่,1
หน้าหมาหน้าหีอีปากดีอีไพร่,1
ตื่นมาทวิตเพื่อสังคมรึยังอีพวกไพร่,1
ปชช โทษรัฐบาลนี้ว่าบริหารกากๆ แต่รัฐบาลนี้จะโทษแต่รัฐบาลก่อนหน้า,0
พูดได้อย่างเต็มปากว่าระบบการจัดการงานคือกากมาก ขนาดเป็นจังหวัดใหญ่รองจากกทมนะ,0
อย่ามาว่าเรดเป็นเหล้าไพร่นะ  ไม่เคยเหล้าขาวยาดองล่ะสิ  ว้ายยยย,0
ปิดเทอมก็เจอเด็กแจกดาวเปิดเทอมก็เจอเด็กลงแรงค์รอเรียนอีดอกกกไม่ได้ว่าเด็กทุกคนเล่นกากแต่อีเด็กที่เล่นแบบนี้มึงต้องการอะไรอีเหี้ย,1
เน็ตทรูแม่งเป็นส่นตีนไรวะ คือกูก็อยู่ใน กทม ไง กากชิบหายโหลดก็ไม่ขึ้น ทุกแอพด้วย ไม่ได้เป็นที่เครื่องกูหรอก เป็นที่มึงอ่ะเน็ต ไอ้ควาย,1
ปากหมาสันดานไพร่,1
หวยแดกสินะอีพวกไพร่,1
วันนี้จะลองซื้อหมูปิ้งกินดู หัดใช้ชีวิตแบบพวกไพร่รีบกินรีบทำงาน,1
หูฟังพังข้างซ้ายตลอดเป็นหอยไร,0
หอยหลอด อ่านละไม่ตอบ ไม่อ่านดีกว่ามะ,0
หอยหลอด แบบนี้แววแห้วสูง,0
ไม่รู้จะกินอะไร ข้าวหมูน้ำมันหอย ปีกไก่ทอดละกัน,0
ตาจะปิดตั้งแต่สั่งหอยทอด,0
อิหนอนเอเลี่ยนที่เค้าออกข่าวกันนี่คิดว่าอีกเดี๋ยวมันคงมาถึงบ้านเรา คือที่บ้านมีหอยทากที่เป็นอาหารมันเยอะมาก อย่ามานะมึง จะเผาให้หมด,0
เหมาะเจาะเนาะมรึง หอยแครงไม่สุกเอ๊ยยย,0
ดูหมีแพนด้าด้วยบรรยากาศเศร้าซึม หอยเอ้ยยยยย,0
สลิ่มถ่อยสมองเท่าหอยหมา,1
อีเพื่อนเลว แทบอ้วก อีหอย แม่งแกล้ง เลว เอาชามาให้กินอีหอย  รู้อยู่ว่าไม่ชอบกลิ่นยังจะแกล้ง อีคลเลว,1
กูจะเริ่มจากอันฟอลพวกใช้ชีวิตของเด็กมอหกให้หมด เปิดมาก็บั่นทอนจิตใจกูเลยหอย ไปตกหน้าผาตายซะไปปป,1
โลกจะสอนให้เราตกหลุมรักคนเลวๆ มองความห่าเหวเป็นสิ่งสวยงาม,0
เมเนบอกเราน่ารัก เราก็คิดว่า จริงอ๋อ ทำไมพี่เลวไม่เห็นบอกเราน่ารักเลย ทีอีหอยตอแหลมารยาสาไถยงึยๆ พี่เลวหลงใหล อีสัด อีดอก,1
ไอโซ่ไอเลว เอากะเค้าไปทั่วเลยอีหอยเป็ดเอ้ย,1
อีเวนน อีดอก อีเอมเนต อีหอย มึงเป็นไรกะวงกู ขนาดนี้ละก็ไม่ต้องมาเชิญวงกูค่ะ ถ้าเชิญเพื่อต้องการให้คนไปเยอะๆ ไม่ต้องมาชวนผู้กู หัวร้อนเลย,1
เล่นเกมแล้วจะปากหมาทำไมวะถามจริงๆเหอะ ต่างคนต่างอยู่มะ ด่ากุเฉ้ย กุก้เล่นของกุมาทั้งวันไม่แพ้ แพ้เพราะมึงแหละหอยหลอด,1
คดีโขมยเพชร  ล้าน แพะเพิ่งโดนปล่อย พวกสลิ่มที่ชอบยกวาทะกรรมหอยๆเช่นไม่ผิดแล้วจะกลัวอะไรเห็นหรือยังว่าสังคมนี่ไม่ผิดแล้วยังโดนอะไร,1
สนิทจนรู้ลับหลังอะ อีหอยขโมยของกุไปเท่าไหร่แล้วของอยู่ในบ้านแท้ๆ ของกุทั้งนั้น หายๆจนรู้นิสัยลับหลังอะ นึกว่าสนิทนะ ขโมยของกุได้ยังไง เลว,1
ทำไมต้องมาฝันเหี้ยไรแบบนี้อะ ควย,0
ทวีตเตอร์เป็นที่เดียวที่กูจะพร่ำเพ้อควยไรก็ได้จริงๆ,0
วันนี้มีงานเกือยทั้งวันอะเเต่ก้กลัวมีเรียนอีกไม่อยากขาดบ่อยควยๆๆ,0
เกมน่าจะพัฒนาให้พูดใส่ไมคได้ละนะ ควย หัวร้อน,0
ปากส้นตีนอยู่เฉยๆสิควย,1
สนิทกับกูก็ไม่ เสือกมาด่าพ่อกูเฉย ประธานหัวควย,1
ยืนรอมาครึ่งชั่วโมงละ ควยจริงๆ,0
ควย มึงมันลูกรักไงไอสัส,1
อีห่า มาค้างบ้านญาติ ปลั๊กก็มีรูเดียว โดนแม่แย่งไปละ เปลืองแบตชิบหาย ฮรือ,0
ชีวิตช่วงนี้แม่งเหมือนกราฟนิ่งอะ  ไม่เศร้า ไม่สุข ไม่ห่าไรเลย,0
ถ้าเรียกมันว่าแดกหรือยัดห่า น่าจะดูชัดกว่า,0
ห่าเอ๊ย เพราะใช้ภาษาอังกฤษสั่งของแล้วนิ่งเลยอะ,0
อิพวกห่ารากไม่ใกล้เวลาตายก็ไม่กระพือแคมลุกมาทำหรอกนะ นอนกันไปสิ ส้นตีน,1
สันดารเว่ออีห่าถ้าไม่ด่าเมนเขาเขาจะไปด่ามึงไหมอะงง,1
กระโดดถีบปาก อีห่านี่สะน้อ,1
อีห่าเบื่อรถเติมก๊าซชิบหาย จะเติมไมไม่บอกก่อนขึ้นวะ ส้นตีน,1
อีห่าเบื่อจริงๆโทรไปไม่รับเนี่ย เรื่องด่วนก็ด่วน มีโทรศัพท์ไว้ทำห่าอะไร ถ้ามันจะกดรับยากขนาดนั้นเอาทุบหัวตัวเองตายไปอีควัย,1
แต่รบไหนที่ไม่แจกห่าแจกเหวอะไรเลยด่าทุกอันอ่ะ,0
คนห่าไรจิตใจดีจังว้ะ  พี่ตูน,0
จะสระผมแต่แชมพูหมด แล้วผมกูเปียกไปแล้ว ความเหี้ยที่แท้ทรู,0
เน็ตหอเหี้ยมาก ตอนเช้ามึงยังจะเหี้ยอีกหรอ,0
จะงอแงก็ไม่รู้จะงอแงในสถานะเหี้ยไรได้อีกอะ,0
อีเหี้ย กูตื่นเเต่เช้ามา วันเเล้ว พรุ่งนี้จะเป็นวันที่สี่,0
นี่มันวินาศสันตะโรเหี้ยไรเนี่ย,0
ไอ้เหี้ยลืมของทำขนม รำคาญตัวเองเลยอะขาดความรับผิดชอบ,0
เหี้ยละมึง สาย ทำไมรถออกก่อนเวลาอ้ะวันนี้ ตกรถเลยจ้า รอวนไป,0
สะพานสูงรถติดเหี้ยไรเนี่ย เป็นชั่วโมงละสัส,0
ควยเอ้ยวันที่กูไม่ดูแต้งเตือนเสือกงดคลาส มาถึงแล้วอีเหี้ยโมโหดีที่สวนทางกับเพื่อน อีเวงงงงงงง,0
ควายเหี้ยไร ตกลงกันแล้วป่ะ,1
